[
  {"intentId":"simple_question","critical":[],"useful":["topic"],"optional":["output_format"]},
  {"intentId":"explanation","critical":[],"useful":["topic","audience"],"optional":["knowledge_level","examples"]},
  {"intentId":"definition","critical":[],"useful":["topic"],"optional":["domain"]},
  {"intentId":"comparison","critical":["comparison_objects"],"useful":["use_case","criteria"],"optional":["budget","region"]},
  {"intentId":"recommendation","critical":[],"useful":["goal","use_case"],"optional":["preferences","budget","region"]},
  {"intentId":"purchase_research","critical":["topic"],"useful":["use_case","budget","region"],"optional":["preferences"]},
  {"intentId":"decision_support","critical":[],"useful":["options","criteria"],"optional":["constraints","preferences"]},
  {"intentId":"troubleshooting","critical":["error_or_symptom"],"useful":["expected_result","environment"],"optional":["recent_changes","reproduction"]},
  {"intentId":"technical_diagnosis","critical":["error_or_symptom"],"useful":["expected_behavior","actual_behavior","environment"],"optional":["logs"]},
  {"intentId":"programming_generation","critical":["purpose","expected_result"],"useful":["programming_language","platform","input_data"],"optional":["constraints","dependencies"]},
  {"intentId":"debugging","critical":["error_or_symptom"],"useful":["code","reproduction","environment"],"optional":["recent_changes"]},
  {"intentId":"code_review","critical":[],"useful":["code","review_focus"],"optional":["runtime","constraints"]},
  {"intentId":"refactoring","critical":[],"useful":["code","goal"],"optional":["constraints","tests"]},
  {"intentId":"configuration","critical":[],"useful":["product","desired_state","environment"],"optional":["version","current_config"]},
  {"intentId":"automation_workflow","critical":[],"useful":["trigger","steps","expected_result"],"optional":["platform","schedule","failure_policy"]},
  {"intentId":"data_analysis","critical":["input_data"],"useful":["question","output_format"],"optional":["method","audience"]},
  {"intentId":"spreadsheet_task","critical":[],"useful":["goal","input_data"],"optional":["spreadsheet_product","constraints"]},
  {"intentId":"document_analysis","critical":["document"],"useful":["analysis_goal"],"optional":["audience","output_format"]},
  {"intentId":"summarization","critical":["source_text"],"useful":["length"],"optional":["audience","output_format"]},
  {"intentId":"information_extraction","critical":["source_text"],"useful":["fields","output_format"],"optional":["missing_value_policy"]},
  {"intentId":"rewriting","critical":["source_text"],"useful":["audience","tone"],"optional":["length","format"]},
  {"intentId":"proofreading","critical":["source_text"],"useful":[],"optional":["variant","change_report"]},
  {"intentId":"translation","critical":["source_text","target_language"],"useful":[],"optional":["audience","register"]},
  {"intentId":"research","critical":["topic"],"useful":["scope","date_range"],"optional":["source_type","output_format"]},
  {"intentId":"current_information","critical":["subject"],"useful":["as_of_date"],"optional":["region","sources"]},
  {"intentId":"planning","critical":[],"useful":["goal","constraints"],"optional":["deadline","resources"]},
  {"intentId":"how_to","critical":[],"useful":["goal","environment"],"optional":["knowledge_level","constraints"]},
  {"intentId":"learning","critical":["topic"],"useful":["goal","knowledge_level"],"optional":["time_available","format"]},
  {"intentId":"problem_solving","critical":[],"useful":["goal","input_data"],"optional":["constraints","method"]},
  {"intentId":"brainstorming","critical":["topic"],"useful":["constraints"],"optional":["audience","quantity"]},
  {"intentId":"creative_writing","critical":[],"useful":["premise","genre"],"optional":["tone","length","audience"]},
  {"intentId":"image_generation_prompt","critical":["subject"],"useful":["style","composition"],"optional":["lighting","aspect_ratio","exclusions"]},
  {"intentId":"email_or_message","critical":["purpose"],"useful":["recipient","tone"],"optional":["length","subject"]},
  {"intentId":"classification","critical":["input_data"],"useful":["labels","criteria"],"optional":["uncertainty_policy","output_format"]},
  {"intentId":"structured_output","critical":["output_format"],"useful":["fields"],"optional":["schema","missing_value_policy"]},
  {"intentId":"file_transformation","critical":[],"useful":["source_format","target_format","input_data"],"optional":["encoding","delimiter","output_path"]},
  {"intentId":"legal_information","critical":["topic"],"useful":["jurisdiction","as_of_date"],"optional":["document","sources"]},
  {"intentId":"medical_information","critical":["topic"],"useful":["symptoms","duration"],"optional":["age_group","medications"]},
  {"intentId":"financial_information","critical":["topic"],"useful":["region","as_of_date"],"optional":["risk_context","time_horizon"]}
]
